{
  "iss": "https://fcuno.com",
  "sub": "66b28753-ce73-4bb7-8785-b80457b753a4",
  "aud": "fcos-identity-sync",
  "iat": 1788160800,
  "exp": 1788161100,
  "jti": "26d3eab1-e901-4e3f-bb19-72a15ea8355c",
  "typ": "fcuno.identity-sync+jwt",
  "event_id": "26d3eab1-e901-4e3f-bb19-72a15ea8355c",
  "event_type": "fcuno.identity.v1",
  "occurred_at": "2026-08-31T10:00:00.000Z",
  "identity": {
    "sub": "66b28753-ce73-4bb7-8785-b80457b753a4",
    "email": "trader@example.com",
    "email_verified": true,
    "username": "trader@example.com",
    "display_name": "Example Trader",
    "is_active": true,
    "use_fcos": true,
    "use_spc": false,
    "identity_revision": 4,
    "credential_revision": 2,
    "revoked_before": "2026-08-30T09:00:00.000Z"
  }
}
